breadcrumbs,image_url,brand,product_name,listing_price,offer_price,discount,product_id,sizes,description,other_images
"['Men', 'Jil Sander', 'Shoes', 'Boots', 'Chelsea boots']",https://img.mytheresa.com/1088/1088/66/jpeg/catalog/product/a7/P00682662.jpg,Jil Sander,Leather Chelsea boots,€ 755,€ 528,30% off,P00682662,"['EU_ 39', 'EU_ 40', 'EU_ 41', 'EU_ 42', 'EU_ 43', 'EU_ 44', 'EU_ 45']","Simple and uncomplicated but nevertheless elegant, these Jil Sander Chelsea boots are crafted in Italy from smooth leather. They feature chunky rubber soles, round toes, and elasticated side gussets for easy on-off wear.upper: leather lining: leather sole: leather insole, rubber sole round toe elasticated sides Made in Italy comes with dust bag , comes with a box Designer colour name: Snow True to size Half sizes please take the next size up European sizes","['//img.mytheresa.com/1088/1088/66/jpeg/catalog/product/a7/P00682662_b1.jpg', '//img.mytheresa.com/1088/1088/66/jpeg/catalog/product/a7/P00682662_b2.jpg', '//img.mytheresa.com/1088/1088/66/jpeg/catalog/product/a7/P00682662_d1.jpg', '//img.mytheresa.com/1088/1088/66/jpeg/catalog/product/a7/P00682662_d2.jpg', '//img.mytheresa.com/1088/1088/66/jpeg/catalog/product/a7/P00682662_d3.jpg', '//img.mytheresa.com/1088/1088/66/jpeg/catalog/product/a7/P00682662_d4.jpg']"
"['Men', 'Dolce&Gabbana', 'Shoes', 'Sneakers', 'Designer sneakers']",https://img.mytheresa.com/1088/1088/66/jpeg/catalog/product/f3/P00677349.jpg,Dolce&Gabbana,Portofino leather sneakers,€ 620,€ 434,30% off,P00677349,"['EU_ 40', 'EU_ 41', 'EU_ 42', 'EU_ 43', 'EU_ 44', 'EU_ 45', 'EU_ 46', 'EU_ 47']","Dolce&Gabbana's Portofino sneakers get a gilded update with metal-plated logo tags secured across the uppers. Made in Italy, the low-top lace-ups are made from nappa leather.upper: leather lining: leather sole: leather insole, rubber sole round toe lace-up Made in Italy comes with dust bag  comes with a box Designer colour name: White True to size Half sizes please take the next size up European sizes","['//img.mytheresa.com/1088/1088/66/jpeg/catalog/product/f3/P00677349_b1.jpg', '//img.mytheresa.com/1088/1088/66/jpeg/catalog/product/f3/P00677349_b2.jpg', '//img.mytheresa.com/1088/1088/66/jpeg/catalog/product/f3/P00677349_d1.jpg', '//img.mytheresa.com/1088/1088/66/jpeg/catalog/product/f3/P00677349_d2.jpg', '//img.mytheresa.com/1088/1088/66/jpeg/catalog/product/f3/P00677349_d3.jpg', '//img.mytheresa.com/1088/1088/66/jpeg/catalog/product/f3/P00677349_d4.jpg']"
"['Men', 'Dolce&Gabbana', 'Shoes', 'Sandals & slides']",https://img.mytheresa.com/1088/1088/66/jpeg/catalog/product/82/P00667226.jpg,Dolce&Gabbana,Embellished leather sandals,€ 730,€ 511,30% off,P00667226,"['EU_ 40', 'EU_ 41', 'EU_ 42', 'EU_ 43', 'EU_ 44', 'EU_ 45', 'EU_ 46']","Step into Dolce&Gabbana’s bold vision with these leather sandals, part of the Dark Side collection that’s inspired by punk rock. This style has triple hook-and-loop closures that are embellished with DG plaques.upper: lamb leather lining: leather sole: leather insole, rubber sole round open toe VELCRO®-fastening ankle strap, VELCRO® fastening Made in Italy comes with dust bag , comes with a box Designer colour name: Black True to size Half sizes please take the next size down European sizes 4,5cm-2"" platform","['//img.mytheresa.com/1088/1088/66/jpeg/catalog/product/82/P00667226_b1.jpg', '//img.mytheresa.com/1088/1088/66/jpeg/catalog/product/82/P00667226_b2.jpg', '//img.mytheresa.com/1088/1088/66/jpeg/catalog/product/82/P00667226_d1.jpg', '//img.mytheresa.com/1088/1088/66/jpeg/catalog/product/82/P00667226_d2.jpg', '//img.mytheresa.com/1088/1088/66/jpeg/catalog/product/82/P00667226_d3.jpg', '//img.mytheresa.com/1088/1088/66/jpeg/catalog/product/82/P00667226_d4.jpg']"
"['Men', 'Zegna', 'Sale', 'Shoes', 'Sneakers']",https://img.mytheresa.com/1088/1088/66/jpeg/catalog/product/7f/P00480289.jpg,Zegna,Leather sneakers with concealed laces,€ 505,€ 353,30% off,P00480289,"['UK_ 5', ' EU 39', 'UK_ 6', ' EU 40', 'UK_ 7', ' EU 41', 'UK_ 8', ' EU 42', 'UK_ 9', ' EU 43', 'UK_ 10', ' EU 44', 'UK_ 11', ' EU 45', 'UK_ 12', ' EU 46', 'UK_ 13', ' EU 47']","Crafted in Italy from supple full-grain leather, these navy blue Ermenegildo Zegna sneakers have partially concealed elasticated laces echoing the label's triple-X motif.upper: deer leather lining: leather sole: leather insole, rubber sole round toe lace-up Made in Italy Designer colour name: Nav  True to size Half sizes please take the next size up UK sizes","['//img.mytheresa.com/1088/1088/66/jpeg/catalog/product/7f/P00480289_b1.jpg', '//img.mytheresa.com/1088/1088/66/jpeg/catalog/product/7f/P00480289_b2.jpg', '//img.mytheresa.com/1088/1088/66/jpeg/catalog/product/7f/P00480289_d1.jpg', '//img.mytheresa.com/1088/1088/66/jpeg/catalog/product/7f/P00480289_d2.jpg', '//img.mytheresa.com/1088/1088/66/jpeg/catalog/product/7f/P00480289_d3.jpg', '//img.mytheresa.com/1088/1088/66/jpeg/catalog/product/7f/P00480289_d4.jpg']"
"['Men', 'Valentino Garavani', 'Shoes', 'Formal shoes', 'Loafers']",https://img.mytheresa.com/1088/1088/66/jpeg/catalog/product/2c/P00689123.jpg,Valentino Garavani,VLogo leather penny loafers,€ 730,€ 511,30% off,P00689123,"['EU_ 39', 'EU_ 40', 'EU_ 41', 'EU_ 42', 'EU_ 43', 'EU_ 44', 'EU_ 45', 'EU_ 46']","These penny loafers from Valentino Garavani are a timeless design. Crafted from leather in Italy, the style carries the signature VLogo chain detail across the vamp and is set atop rubber treaded soles.upper: leather lining: leather sole: leather insole, rubber sole almond toe Made in Italy comes with dust bags comes with a box Designer colour name: Nero True to size Half sizes please take the next size down European sizes","['//img.mytheresa.com/1088/1088/66/jpeg/catalog/product/2c/P00689123_b1.jpg', '//img.mytheresa.com/1088/1088/66/jpeg/catalog/product/2c/P00689123_b2.jpg', '//img.mytheresa.com/1088/1088/66/jpeg/catalog/product/2c/P00689123_d1.jpg', '//img.mytheresa.com/1088/1088/66/jpeg/catalog/product/2c/P00689123_d2.jpg', '//img.mytheresa.com/1088/1088/66/jpeg/catalog/product/2c/P00689123_d3.jpg', '//img.mytheresa.com/1088/1088/66/jpeg/catalog/product/2c/P00689123_d4.jpg']"
"['Men', 'Stone Island', 'Shoes', 'Boots', 'Lace up boots']",https://img.mytheresa.com/1088/1088/66/jpeg/catalog/product/5b/P00706960.jpg,Stone Island,Suede lace-up ankle boots,€ 415,€ 290,30% off,P00706960,"['EU_ 41', 'EU_ 42', 'EU_ 43', 'EU_ 44', 'EU_ 45', 'EU_ 46']","These suede lace-up boots from Stone Island rest atop rubber soles that feature slip-proof Vibram®. The brown pair is made in Italy and accented by the label’s logo on the tongue and metal rivets.upper: leather lining: leather sole: leather insole, rubber sole almond toe lace-up Made in Portugal comes with a box Designer colour name: Military Green True to size Half sizes please take the next size up European sizes","['//img.mytheresa.com/1088/1088/66/jpeg/catalog/product/5b/P00706960_b1.jpg', '//img.mytheresa.com/1088/1088/66/jpeg/catalog/product/5b/P00706960_b2.jpg', '//img.mytheresa.com/1088/1088/66/jpeg/catalog/product/5b/P00706960_d1.jpg', '//img.mytheresa.com/1088/1088/66/jpeg/catalog/product/5b/P00706960_d2.jpg', '//img.mytheresa.com/1088/1088/66/jpeg/catalog/product/5b/P00706960_d3.jpg', '//img.mytheresa.com/1088/1088/66/jpeg/catalog/product/5b/P00706960_d4.jpg']"
"['Men', 'Valentino Garavani', 'Shoes', 'Sneakers', 'Designer sneakers']",https://img.mytheresa.com/1088/1088/66/jpeg/catalog/product/eb/P00689140.jpg,Valentino Garavani,Open Skate leather sneakers,€ 640,€ 448,30% off,P00689140,"['EU_ 39', 'EU_ 40', 'EU_ 41', 'EU_ 42', 'EU_ 43', 'EU_ 44', 'EU_ 45', 'EU_ 46']","Valentino Garavani's Open Skate sneakers embody the refined rebellion of the After Club '22 collection. Balancing padded tongues and contrast coloring, these leather low-tops are finished with discreet house coding.upper: cow leather sole: fabric insole, rubber sole round toe lace-up Made in Italy comes with dust bags, comes with a box Designer colour name: Bianco-Nero-P.Grey True to size Half sizes please take the next size down European sizes","['//img.mytheresa.com/1088/1088/66/jpeg/catalog/product/eb/P00689140_b1.jpg', '//img.mytheresa.com/1088/1088/66/jpeg/catalog/product/eb/P00689140_b2.jpg', '//img.mytheresa.com/1088/1088/66/jpeg/catalog/product/eb/P00689140_d1.jpg', '//img.mytheresa.com/1088/1088/66/jpeg/catalog/product/eb/P00689140_d2.jpg', '//img.mytheresa.com/1088/1088/66/jpeg/catalog/product/eb/P00689140_d3.jpg', '//img.mytheresa.com/1088/1088/66/jpeg/catalog/product/eb/P00689140_d4.jpg']"
"['Men', 'Valentino Garavani', 'Shoes', 'Sneakers', 'Designer sneakers']",https://img.mytheresa.com/1088/1088/66/jpeg/catalog/product/7a/P00570095.jpg,Valentino Garavani,One Stud leather sneakers,€ 585,€ 409,30% off,P00570095,"['EU_ 39', 'EU_ 40', 'EU_ 41', 'EU_ 42', 'EU_ 43', 'EU_ 44', 'EU_ 45', 'EU_ 46', 'EU_ 47']","Inspired by skateboarding styles, these low-top sneakers from Valentino Garavani are made from nappa leather and feature molded stud detailing on the rubber soles and a single Maxi stud embellishment.upper: lamb leather lining: leather sole: leather insole, rubber sole round toe lace-up Made in Italy Designer colour name: White Grey Black Comes with a box Comes with dust bags Comes with extra laces Fits large to size - we recommend trying one size smaller European sizes","['//img.mytheresa.com/1088/1088/66/jpeg/catalog/product/7a/P00570095_b1.jpg', '//img.mytheresa.com/1088/1088/66/jpeg/catalog/product/7a/P00570095_b2.jpg', '//img.mytheresa.com/1088/1088/66/jpeg/catalog/product/7a/P00570095_d1.jpg', '//img.mytheresa.com/1088/1088/66/jpeg/catalog/product/7a/P00570095_d2.jpg', '//img.mytheresa.com/1088/1088/66/jpeg/catalog/product/7a/P00570095_d3.jpg', '//img.mytheresa.com/1088/1088/66/jpeg/catalog/product/7a/P00570095_d4.jpg']"
"['Men', 'Valentino Garavani', 'Shoes', 'Sneakers', 'Low-Top']",https://img.mytheresa.com/1088/1088/66/jpeg/catalog/product/a8/P00675817.jpg,Valentino Garavani,Open Skate leather sneakers,€ 585,€ 409,30% off,P00675817,"['EU_ 39', 'EU_ 40', 'EU_ 41', 'EU_ 42', 'EU_ 43', 'EU_ 44', 'EU_ 45', 'EU_ 46']","Valentino Garavani's Open Skate sneakers embody the refined rebellion of the After Club '22 collection. Balancing padded tongues and contrast coloring, these leather low-tops are finished with discreet house coding.upper: cow leather lining: fabric sole: fabric insole, rubber sole round toe lace-up Made in Italy comes with extra laces comes with a box Designer colour name: Bianco-Nero-P.Grey Fits large to size - we recommend trying one size smaller European sizes","['//img.mytheresa.com/1088/1088/66/jpeg/catalog/product/a8/P00675817_b1.jpg', '//img.mytheresa.com/1088/1088/66/jpeg/catalog/product/a8/P00675817_b2.jpg', '//img.mytheresa.com/1088/1088/66/jpeg/catalog/product/a8/P00675817_d1.jpg', '//img.mytheresa.com/1088/1088/66/jpeg/catalog/product/a8/P00675817_d2.jpg', '//img.mytheresa.com/1088/1088/66/jpeg/catalog/product/a8/P00675817_d3.jpg', '//img.mytheresa.com/1088/1088/66/jpeg/catalog/product/a8/P00675817_d4.jpg']"
"['Men', 'Valentino Garavani', 'Shoes', 'Boots', 'Chelsea boots']",https://img.mytheresa.com/1088/1088/66/jpeg/catalog/product/66/P00689113.jpg,Valentino Garavani,Beatle VLogo leather Chelsea boots,€ 855,€ 598,30% off,P00689113,"['EU_ 40', 'EU_ 41', 'EU_ 42', 'EU_ 43', 'EU_ 44', 'EU_ 45', 'EU_ 46']","The Beatle VLogo Chelsea boots from Valentino Garavani are made in Italy from smooth calfskin leather with elasticated gussets and pull tabs. The pair is finished with tonal VLogo hardware at the back.upper: leather lining: leather sole: leather insole, rubber sole round toe elasticated sides Made in Italy comes with a box comes with dust bags Designer colour name: Nero True to size Half sizes please take the next size up European sizes","['//img.mytheresa.com/1088/1088/66/jpeg/catalog/product/66/P00689113_b1.jpg', '//img.mytheresa.com/1088/1088/66/jpeg/catalog/product/66/P00689113_b2.jpg', '//img.mytheresa.com/1088/1088/66/jpeg/catalog/product/66/P00689113_d1.jpg', '//img.mytheresa.com/1088/1088/66/jpeg/catalog/product/66/P00689113_d2.jpg', '//img.mytheresa.com/1088/1088/66/jpeg/catalog/product/66/P00689113_d3.jpg', '//img.mytheresa.com/1088/1088/66/jpeg/catalog/product/66/P00689113_d4.jpg']"
"['Men', 'Valentino Garavani', 'Shoes', 'Loafers']",https://img.mytheresa.com/1088/1088/66/jpeg/catalog/product/24/P00675783.jpg,Valentino Garavani,VLogo Chain leather loafers,€ 635,€ 444,30% off,P00675783,"['EU_ 39', 'EU_ 40', 'EU_ 41', 'EU_ 42', 'EU_ 43', 'EU_ 44', 'EU_ 45', 'EU_ 46', 'EU_ 47']","From Valentino Garavani's rebellious After Club '22 collection, the VLogo Chain loafers add glamour to a classic style. Made with smooth leather uppers, the rich coloring is balanced by antique-finished VLogo detailing.upper: cow leather lining: cow leather sole: leather insole and sole almond toe Made in Italy comes with dust bags comes with a box Designer colour name: Nero  True to size Half sizes please take the next size down European sizes","['//img.mytheresa.com/1088/1088/66/jpeg/catalog/product/24/P00675783_b1.jpg', '//img.mytheresa.com/1088/1088/66/jpeg/catalog/product/24/P00675783_b2.jpg', '//img.mytheresa.com/1088/1088/66/jpeg/catalog/product/24/P00675783_d1.jpg', '//img.mytheresa.com/1088/1088/66/jpeg/catalog/product/24/P00675783_d2.jpg', '//img.mytheresa.com/1088/1088/66/jpeg/catalog/product/24/P00675783_d3.jpg', '//img.mytheresa.com/1088/1088/66/jpeg/catalog/product/24/P00675783_d4.jpg']"
"['Men', 'Valentino Garavani', 'Shoes', 'Boots', 'Lace up boots']",https://img.mytheresa.com/1088/1088/66/jpeg/catalog/product/23/P00675781.jpg,Valentino Garavani,Camden leather lace-up boots,€ 799,€ 559,30% off,P00675781,"['EU_ 39', 'EU_ 40', 'EU_ 41', 'EU_ 42', 'EU_ 43', 'EU_ 44', 'EU_ 45', 'EU_ 46']","Crafted in the style of combat boots, Valentino Garavani's Camden ankle boots have lace-up uppers that fit close to the feet. They're made from leather that's polished to a high shine.upper: leather lining: leather sole: leather insole, rubber sole round toe lace-up, zipped side Made in Italy comes with dust bags comes with a box Designer colour name: Nero True to size Half sizes please take the next size up European sizes","['//img.mytheresa.com/1088/1088/66/jpeg/catalog/product/23/P00675781_b1.jpg', '//img.mytheresa.com/1088/1088/66/jpeg/catalog/product/23/P00675781_b2.jpg', '//img.mytheresa.com/1088/1088/66/jpeg/catalog/product/23/P00675781_d1.jpg', '//img.mytheresa.com/1088/1088/66/jpeg/catalog/product/23/P00675781_d2.jpg', '//img.mytheresa.com/1088/1088/66/jpeg/catalog/product/23/P00675781_d3.jpg', '//img.mytheresa.com/1088/1088/66/jpeg/catalog/product/23/P00675781_d4.jpg']"
"['Men', 'Valentino Garavani', 'Shoes', 'Sneakers', 'Low-Top']",https://img.mytheresa.com/1088/1088/66/jpeg/catalog/product/b3/P00689115.jpg,Valentino Garavani,One Stud XL leather platform sneakers,€ 730,€ 511,30% off,P00689115,"['EU_ 39', 'EU_ 40', 'EU_ 41', 'EU_ 42', 'EU_ 43', 'EU_ 44', 'EU_ 45', 'EU_ 46']","Back with an XL platform refresh, the One Stud low-top sneakers from Valentino Garavani are made from nappa leather and have a molded stud detail applied to one side and onto the rubber soles at the heel.upper: leather lining: leather sole: leather insole, rubber sole lace-up Made in Italy comes with dust bags comes with a box Designer colour name: Bianco True to size Half sizes please take the next size up European sizes 5,0cm-2"" heel (size EU 42)  ","['//img.mytheresa.com/1088/1088/66/jpeg/catalog/product/b3/P00689115_b1.jpg', '//img.mytheresa.com/1088/1088/66/jpeg/catalog/product/b3/P00689115_b2.jpg', '//img.mytheresa.com/1088/1088/66/jpeg/catalog/product/b3/P00689115_d1.jpg', '//img.mytheresa.com/1088/1088/66/jpeg/catalog/product/b3/P00689115_d2.jpg', '//img.mytheresa.com/1088/1088/66/jpeg/catalog/product/b3/P00689115_d3.jpg', '//img.mytheresa.com/1088/1088/66/jpeg/catalog/product/b3/P00689115_d4.jpg']"
"['Men', 'Valentino Garavani', 'Shoes', 'Loafers']",https://img.mytheresa.com/1088/1088/66/jpeg/catalog/product/eb/P00675848.jpg,Valentino Garavani,VLogo Chain leather loafers,€ 635,€ 444,30% off,P00675848,"['EU_ 39', 'EU_ 40', 'EU_ 41', 'EU_ 42', 'EU_ 43', 'EU_ 44', 'EU_ 45', 'EU_ 46']","From Valentino Garavani's rebellious After Club '22 collection, the VLogo Chain loafers add glamour to a classic style. Made with smooth leather uppers, the rich coloring is balanced by antique-finished VLogo detailing.upper: cow leather lining: cow leather sole: leather insole and sole almond toe Made in Italy comes with dust bags comes with a box Designer colour name: Bitter Chocolate  True to size Half sizes please take the next size down European sizes","['//img.mytheresa.com/1088/1088/66/jpeg/catalog/product/eb/P00675848_b1.jpg', '//img.mytheresa.com/1088/1088/66/jpeg/catalog/product/eb/P00675848_b2.jpg', '//img.mytheresa.com/1088/1088/66/jpeg/catalog/product/eb/P00675848_d1.jpg', '//img.mytheresa.com/1088/1088/66/jpeg/catalog/product/eb/P00675848_d2.jpg', '//img.mytheresa.com/1088/1088/66/jpeg/catalog/product/eb/P00675848_d3.jpg', '//img.mytheresa.com/1088/1088/66/jpeg/catalog/product/eb/P00675848_d4.jpg']"
"['Men', 'Jil Sander', 'Shoes', 'Sneakers', 'Designer sneakers']",https://img.mytheresa.com/1088/1088/66/jpeg/catalog/product/c2/P00682654.jpg,Jil Sander,Leather sneakers,€ 419,€ 293,30% off,P00682654,"['EU_ 39', 'EU_ 40', 'EU_ 41', 'EU_ 42', 'EU_ 43', 'EU_ 44', 'EU_ 45']","These white leather sneakers from Jil Sander are crafted with a minimalist attitude. The lace-up style is set on rubber soles.upper: leather lining: leather sole: leather insole, rubber sole round toe lace-up Made in Portugal comes with dust bag  comes with a box Designer colour name: Ivory True to size Half sizes please take the next size up European sizes","['//img.mytheresa.com/1088/1088/66/jpeg/catalog/product/c2/P00682654_b1.jpg', '//img.mytheresa.com/1088/1088/66/jpeg/catalog/product/c2/P00682654_b2.jpg', '//img.mytheresa.com/1088/1088/66/jpeg/catalog/product/c2/P00682654_d1.jpg', '//img.mytheresa.com/1088/1088/66/jpeg/catalog/product/c2/P00682654_d2.jpg', '//img.mytheresa.com/1088/1088/66/jpeg/catalog/product/c2/P00682654_d3.jpg', '//img.mytheresa.com/1088/1088/66/jpeg/catalog/product/c2/P00682654_d4.jpg']"
"['Men', 'Brunello Cucinelli', 'Shoes', 'Sneakers', 'Designer sneakers']",https://img.mytheresa.com/1088/1088/66/jpeg/catalog/product/1d/P00681196.jpg,Brunello Cucinelli,Low-top suede sneakers,€ 779,€ 545,30% off,P00681196,"['EU_ 39', 'EU_ 40', 'EU_ 41', 'EU_ 42', 'EU_ 43', 'EU_ 44', 'EU_ 45', 'EU_ 46']","These low-top sneakers from Brunello Cucinelli are a timeless wardrobe staple. They're crafted from supple suede with a leather heel tab and a lightweight sole.upper: leather lining: leather sole: leather insole, rubber sole round toe lace-up Made in Italy comes with dust bag  comes with a box Designer colour name: Grey True to size Half sizes please take the next size up European sizes","['//img.mytheresa.com/1088/1088/66/jpeg/catalog/product/1d/P00681196_b1.jpg', '//img.mytheresa.com/1088/1088/66/jpeg/catalog/product/1d/P00681196_b2.jpg', '//img.mytheresa.com/1088/1088/66/jpeg/catalog/product/1d/P00681196_d1.jpg', '//img.mytheresa.com/1088/1088/66/jpeg/catalog/product/1d/P00681196_d2.jpg', '//img.mytheresa.com/1088/1088/66/jpeg/catalog/product/1d/P00681196_d3.jpg', '//img.mytheresa.com/1088/1088/66/jpeg/catalog/product/1d/P00681196_d4.jpg']"
"['Men', 'Valentino Garavani', 'Shoes', 'Sneakers', 'Designer sneakers']",https://img.mytheresa.com/1088/1088/66/jpeg/catalog/product/cf/P00675756.jpg,Valentino Garavani,One Stud leather sneakers,€ 585,€ 409,30% off,P00675756,"['EU_ 39', 'EU_ 40', 'EU_ 41', 'EU_ 42', 'EU_ 43', 'EU_ 44', 'EU_ 45', 'EU_ 46', 'EU_ 47']","Inspired by skateboarding styles, these low-top sneakers from Valentino Garavani are made from nappa leather and feature molded stud detailing on the rubber soles and a single Maxi stud embellishment.upper: lamb leather lining: leather sole: fabric insole, rubber sole round toe lace-up Made in Italy comes with extra laces comes with dust bags comes with a box Designer colour name: Nero-Pastel Grey/Nero/Nero Fits large to size - we recommend trying one size smaller European sizes","['//img.mytheresa.com/1088/1088/66/jpeg/catalog/product/cf/P00675756_b1.jpg', '//img.mytheresa.com/1088/1088/66/jpeg/catalog/product/cf/P00675756_b2.jpg', '//img.mytheresa.com/1088/1088/66/jpeg/catalog/product/cf/P00675756_d1.jpg', '//img.mytheresa.com/1088/1088/66/jpeg/catalog/product/cf/P00675756_d2.jpg', '//img.mytheresa.com/1088/1088/66/jpeg/catalog/product/cf/P00675756_d3.jpg', '//img.mytheresa.com/1088/1088/66/jpeg/catalog/product/cf/P00675756_d4.jpg']"
"['Men', 'Valentino Garavani', 'Shoes', 'Sandals & slides']",https://img.mytheresa.com/1088/1088/66/jpeg/catalog/product/c6/P00675786.jpg,Valentino Garavani,Rockstud leather sandals,€ 609,€ 426,30% off,P00675786,"['EU_ 39', 'EU_ 40', 'EU_ 41', 'EU_ 42', 'EU_ 43', 'EU_ 44', 'EU_ 45', 'EU_ 46', 'EU_ 47']","These sleek sandals from Valentino Garavani are made of supple black leather, with round open toes and tonal, oversized Rockstuds decorating the straps.upper: leather lining: leather trim: platinum-plated studs sole: leather insole, rubber sole round open toe Made in Italy comes with dust bags comes with a box Designer colour name: Nero True to size Half sizes please take the next size down European sizes","['//img.mytheresa.com/1088/1088/66/jpeg/catalog/product/c6/P00675786_b1.jpg', '//img.mytheresa.com/1088/1088/66/jpeg/catalog/product/c6/P00675786_b2.jpg', '//img.mytheresa.com/1088/1088/66/jpeg/catalog/product/c6/P00675786_d1.jpg', '//img.mytheresa.com/1088/1088/66/jpeg/catalog/product/c6/P00675786_d2.jpg', '//img.mytheresa.com/1088/1088/66/jpeg/catalog/product/c6/P00675786_d3.jpg', '//img.mytheresa.com/1088/1088/66/jpeg/catalog/product/c6/P00675786_d4.jpg']"
"['Men', 'Jil Sander', 'Shoes', 'Sandals & slides']",https://img.mytheresa.com/1088/1088/66/jpeg/catalog/product/cc/P00682620.jpg,Jil Sander,Leather sandals,€ 419,€ 293,30% off,P00682620,"['EU_ 39', 'EU_ 40', 'EU_ 41', 'EU_ 42', 'EU_ 43', 'EU_ 44', 'EU_ 45']","Jil Sander’s esteemed minimalism has captivated the industry for decades. Made from tactile lambskin, step into the label’s perenially polished image with the wrapped vamp silhouette of these slip-on sandals.upper: lamb leather lining: leather sole: leather insole and sole round open toe Made in Italy comes with dust bag , comes with a box Designer colour name: Black True to size Half sizes please take the next size up European sizes","['//img.mytheresa.com/1088/1088/66/jpeg/catalog/product/cc/P00682620_b1.jpg', '//img.mytheresa.com/1088/1088/66/jpeg/catalog/product/cc/P00682620_b2.jpg', '//img.mytheresa.com/1088/1088/66/jpeg/catalog/product/cc/P00682620_d1.jpg', '//img.mytheresa.com/1088/1088/66/jpeg/catalog/product/cc/P00682620_d2.jpg', '//img.mytheresa.com/1088/1088/66/jpeg/catalog/product/cc/P00682620_d3.jpg', '//img.mytheresa.com/1088/1088/66/jpeg/catalog/product/cc/P00682620_d4.jpg']"
"['Men', 'Maison Margiela', 'Shoes', 'Sneakers', 'Designer sneakers']",https://img.mytheresa.com/1088/1088/66/jpeg/catalog/product/8e/P00710660.jpg,Maison Margiela,Replica suede-trimmed sneakers,€ 375,€ 262,30% off,P00710660,"['EU_ 39', 'EU_ 40', 'EU_ 41', 'EU_ 42', 'EU_ 43', 'EU_ 44', 'EU_ 45', 'EU_ 46', 'EU_ 47']","This update to Maison Margiela's iconic Replica sneakers sees the sleek silhouette reimagined in canvas, featuring suede trims. The lace-up design sits atop lightweight rubber soles for comfortable wear.upper: leather, fabric lining: leather, fabric sole: leather insole, rubber sole round toe lace-up Made in Italy comes with dust bags, comes with a box Designer colour name: Variant 2 True to size Half sizes please take the next size up European sizes","['//img.mytheresa.com/1088/1088/66/jpeg/catalog/product/8e/P00710660_b1.jpg', '//img.mytheresa.com/1088/1088/66/jpeg/catalog/product/8e/P00710660_b2.jpg', '//img.mytheresa.com/1088/1088/66/jpeg/catalog/product/8e/P00710660_d1.jpg', '//img.mytheresa.com/1088/1088/66/jpeg/catalog/product/8e/P00710660_d2.jpg', '//img.mytheresa.com/1088/1088/66/jpeg/catalog/product/8e/P00710660_d3.jpg', '//img.mytheresa.com/1088/1088/66/jpeg/catalog/product/8e/P00710660_d4.jpg']"
"['Men', 'Valentino Garavani', 'Shoes', 'Sneakers', 'Low-Top']",https://img.mytheresa.com/1088/1088/66/jpeg/catalog/product/85/P00689117.jpg,Valentino Garavani,One Stud leather sneakers,€ 640,€ 448,30% off,P00689117,"['EU_ 39', 'EU_ 40', 'EU_ 41', 'EU_ 42', 'EU_ 43', 'EU_ 44', 'EU_ 45', 'EU_ 46', 'EU_ 47']","Inspired by skateboarding styles, these low-top sneakers from Valentino Garavani are made from nappa leather and feature molded stud detailing on the rubber soles and a single stud embellishment.upper: calf leather lining: leather trim: platinum-plated studs sole: leather insole, rubber sole round toe lace-up Made in Italy comes with dust bags comes with extra laces comes with a box Designer colour name: Bianco-Nero/Pastel Grey  True to size Half sizes please take the next size up European sizes","['//img.mytheresa.com/1088/1088/66/jpeg/catalog/product/85/P00689117_b1.jpg', '//img.mytheresa.com/1088/1088/66/jpeg/catalog/product/85/P00689117_b2.jpg', '//img.mytheresa.com/1088/1088/66/jpeg/catalog/product/85/P00689117_d1.jpg', '//img.mytheresa.com/1088/1088/66/jpeg/catalog/product/85/P00689117_d2.jpg', '//img.mytheresa.com/1088/1088/66/jpeg/catalog/product/85/P00689117_d3.jpg', '//img.mytheresa.com/1088/1088/66/jpeg/catalog/product/85/P00689117_d4.jpg']"
